{
  "metadata": {
    "version": "1.0",
    "lastUpdated": "2024-10-30",
    "totalSections": 15,
    "embeddingModel": "distilbert-base-uncased",
    "embeddingDimensions": 768
  },
  "sections": {
    "experience": {
      "react": {
        "id": "exp_react",
        "keywords": ["react", "reactjs", "jsx", "hooks", "components", "frontend", "ui"],
        "embeddings": null,
        "responses": {
          "hr": "Serhii has 4+ years of professional React development experience, having built 20+ production applications with modern React patterns including hooks, context API, and performance optimization techniques. He has successfully led React migration projects and mentored junior developers in React best practices.",
          "developer": "I've been working with React for 4+ years now. Really love the hooks ecosystem and functional components. Built everything from simple portfolios to complex e-commerce platforms and admin dashboards with React. Always excited about new React features and performance optimizations.",
          "friend": "Oh React! ðŸš€ That's definitely one of my favorite frameworks to work with. Been coding with it for 4+ years and still get excited about new features like Suspense and concurrent rendering. The component-based thinking just clicks with me, you know?"
        },
        "details": {
          "years": 4,
          "level": "senior",
          "projects": ["E-commerce Platform", "Admin Dashboard", "Portfolio Website", "Task Management App", "Real-time Chat App"],
          "skills": ["Hooks", "Context API", "Redux", "React Router", "Testing Library", "Next.js", "Performance Optimization"],
          "achievements": ["Improved app performance by 40%", "Mentored 3 junior developers", "Led React 16 to 18 migration"]
        },
        "relatedSections": ["javascript", "typescript", "frontend", "nextjs"]
      },
      "javascript": {
        "id": "exp_javascript",
        "keywords": ["javascript", "js", "es6", "es2020", "vanilla", "frontend", "backend"],
        "embeddings": null,
        "responses": {
          "hr": "Serhii possesses advanced JavaScript skills with 6+ years of experience in modern ES6+ development, including async/await, modules, and performance optimization. He has expertise in both frontend and backend JavaScript development.",
          "developer": "JavaScript is my bread and butter - 6+ years of experience with everything from vanilla JS to modern frameworks. Love working with ES6+ features, async patterns, and exploring new JavaScript APIs. Comfortable with both browser and Node.js environments.",
          "friend": "JavaScript is like my native language at this point! ðŸ˜„ Been writing it for 6+ years and still discover cool new tricks. From vanilla DOM manipulation to complex async workflows - it never gets boring!"
        },
        "details": {
          "years": 6,
          "level": "expert",
          "specialties": ["Async Programming", "DOM Manipulation", "Performance Optimization", "Module Systems", "Event Handling"],
          "environments": ["Browser", "Node.js", "Web Workers"],
          "frameworks": ["React", "Vue", "Express", "Fastify"]
        },
        "relatedSections": ["react", "nodejs", "typescript", "frontend"]
      },
      "nodejs": {
        "id": "exp_nodejs",
        "keywords": ["nodejs", "node", "backend", "server", "api", "express"],
        "embeddings": null,
        "responses": {
          "hr": "Serhii has 3+ years of Node.js backend development experience, building scalable APIs and microservices. He has worked with various Node.js frameworks and has experience with database integration and deployment strategies.",
          "developer": "I've been building backend services with Node.js for 3+ years. Love the JavaScript everywhere approach and the npm ecosystem. Built REST APIs, GraphQL services, and real-time applications with Socket.io.",
          "friend": "Node.js opened up the backend world for me! ðŸŒŸ 3+ years of building servers and APIs. It's amazing how you can use the same language for frontend and backend - makes context switching so much easier."
        },
        "details": {
          "years": 3,
          "level": "intermediate",
          "frameworks": ["Express", "Fastify", "Koa", "NestJS"],
          "databases": ["MongoDB", "PostgreSQL", "Redis"],
          "tools": ["PM2", "Docker", "Jest", "Supertest"]
        },
        "relatedSections": ["javascript", "api", "database", "docker"]
      }
    },
    "skills": {
      "typescript": {
        "id": "skill_typescript",
        "keywords": ["typescript", "ts", "types", "interfaces", "generics"],
        "embeddings": null,
        "responses": {
          "hr": "Serhii has strong TypeScript expertise with 3+ years of experience, implementing type-safe applications and improving code quality through static typing. He has experience with advanced TypeScript features and tooling.",
          "developer": "TypeScript has become essential in my workflow over the past 3+ years. Love how it catches errors early and makes refactoring so much safer. Comfortable with advanced types, generics, and the whole TS ecosystem.",
          "friend": "TypeScript is a game-changer! ðŸ’ª Started using it 3+ years ago and now I can't imagine going back to plain JavaScript for larger projects. The IntelliSense and error catching are just too good to give up."
        },
        "details": {
          "years": 3,
          "level": "advanced",
          "features": ["Generics", "Utility Types", "Conditional Types", "Mapped Types", "Decorators"],
          "tools": ["TSC", "ts-node", "ESLint", "Prettier"],
          "projects": ["Type-safe APIs", "React with TypeScript", "Node.js services"]
        },
        "relatedSections": ["javascript", "react", "nodejs"]
      },
      "scss": {
        "id": "skill_scss",
        "keywords": ["scss", "sass", "css", "styling", "preprocessor", "frontend"],
        "embeddings": null,
        "responses": {
          "hr": "Serhii has extensive SCSS/Sass experience with 4+ years of creating maintainable, scalable stylesheets. He follows BEM methodology and has experience with responsive design and CSS architecture.",
          "developer": "SCSS is my go-to for styling - 4+ years of experience with mixins, functions, and modular architecture. I follow BEM methodology and focus on maintainable, reusable styles. Love the power of Sass features.",
          "friend": "SCSS makes CSS so much more fun to write! ðŸŽ¨ 4+ years of creating beautiful, maintainable styles. Mixins and variables are lifesavers, and I'm all about that organized, modular approach."
        },
        "details": {
          "years": 4,
          "level": "advanced",
          "methodologies": ["BEM", "SMACSS", "Atomic CSS"],
          "features": ["Mixins", "Functions", "Variables", "Nesting", "Partials"],
          "tools": ["Sass", "PostCSS", "Autoprefixer", "PurgeCSS"]
        },
        "relatedSections": ["css", "frontend", "responsive"]
      },
      "git": {
        "id": "skill_git",
        "keywords": ["git", "version control", "github", "gitlab", "branching"],
        "embeddings": null,
        "responses": {
          "hr": "Serhii has comprehensive Git expertise with 5+ years of experience in version control, branching strategies, and collaborative development workflows. He has experience with Git workflows in team environments.",
          "developer": "Git is essential to my daily workflow - 5+ years of experience with branching, merging, rebasing, and collaborative development. Comfortable with complex Git operations and different workflow strategies.",
          "friend": "Git saved my code so many times! ðŸ˜… 5+ years of commits, branches, and the occasional merge conflict. I've learned to love the command line and proper commit messages make all the difference."
        },
        "details": {
          "years": 5,
          "level": "advanced",
          "workflows": ["Git Flow", "GitHub Flow", "Feature Branching"],
          "operations": ["Rebase", "Cherry-pick", "Squash", "Bisect"],
          "platforms": ["GitHub", "GitLab", "Bitbucket"]
        },
        "relatedSections": ["development", "collaboration"]
      }
    },
    "projects": {
      "portfolio": {
        "id": "proj_portfolio",
        "keywords": ["portfolio", "website", "personal", "showcase", "static"],
        "embeddings": null,
        "responses": {
          "hr": "Serhii's portfolio website demonstrates his technical skills through a performance-optimized static site built with vanilla JavaScript, SCSS, and modern build tools. The site features multi-language support and responsive design.",
          "developer": "This portfolio site you're looking at! Built it with vanilla JS and SCSS to keep things lightweight and fast. Includes a translation system, responsive design, and now this AI chat feature. Performance was a key focus.",
          "friend": "You're actually looking at one of my favorite projects right now! ðŸ˜Š Built this whole portfolio from scratch with vanilla JS because I wanted to prove you don't always need a framework. Plus, it loads super fast!"
        },
        "details": {
          "technologies": ["Vanilla JavaScript", "SCSS", "HTML5", "Node.js", "JSON"],
          "features": ["Multi-language support", "Responsive design", "Performance optimized", "AI Chat Bot", "Project showcase"],
          "metrics": ["<2s load time", "100% accessibility score", "Mobile-first design"],
          "repository": "https://github.com/serhii/portfolio"
        },
        "relatedSections": ["javascript", "scss", "responsive", "performance"]
      },
      "ecommerce": {
        "id": "proj_ecommerce",
        "keywords": ["ecommerce", "shop", "store", "react", "payment", "cart"],
        "embeddings": null,
        "responses": {